{
  "date": "2026-09-19",
  "generated_at": "2026-09-19T10:00:00+09:00",
  "period": { "from": "2026-09-14", "to": "2026-09-18" },
  "overview_ko": "파리 'Roadmaps to New Nuclear' 회의에서 한·미·일·유럽 등 9개 산업협회가 정부의 장기 지원을 촉구했고, NEA는 표준화·연속 건설 시 대형원전과 SMR 모두 발전단가를 100달러/MWh 아래로 낮출 수 있다고 제시했다. 유럽에서는 슬로베니아 JEK2가 AP1000·EPR 두 노형을 전제로 사업 구체화에 들어갔고, EIB의 첫 SMR 투자와 구글–포툼 로비사 원전 장기구매계약이 나오며 금융·수요 측 신호가 이어졌다. 영국은 규제 개혁 계획과 함께 X-energy Xe-100의 GDA 착수를 결정했고, 중국은 창장 3호기 상업운전과 화룽원 2.0 착공으로 건설 속도를 유지했다. 일본은 주부전력 하마오카 데이터 조작으로 재가동 신청을 철회해 재가동 흐름에 제동이 걸렸다. 영업 관점: 유럽 신규 사업은 노형 사전 선별과 표준화·금융 조달 능력이 수주 경쟁의 핵심 변수로 부상하고 있다.",
  "countries_pulse": [
    { "country": "SI", "name_ko": "슬로베니아", "stance": "expanding", "signal": "JEK2 부지 설계 구체화 — AP1000·EPR 두 노형 전제, FID 2029·상업운전 2041 목표", "article_ids": ["2026-09-19-01"] },
    { "country": "GB", "name_ko": "영국", "stance": "expanding", "signal": "규제기관 개혁(2027년 말 완료 목표)과 Xe-100 GDA 착수로 SMR 인허가 속도전", "article_ids": ["2026-09-19-04", "2026-09-19-10"] },
    { "country": "FI", "name_ko": "핀란드", "stance": "expanding", "signal": "빅테크 장기 PPA로 기존 원전 계속운전 재원 확보, EIB가 열공급 SMR 첫 투자", "article_ids": ["2026-09-19-05", "2026-09-19-07"] },
    { "country": "EU", "name_ko": "EU", "stance": "expanding", "signal": "집행위원장 연설에서 원자력 포함 청정에너지 '더 강하게' 추진 언급, EIB SMR 투자 개시", "article_ids": ["2026-09-19-07", "2026-09-19-11"] },
    { "country": "US", "name_ko": "미국", "stance": "expanding", "signal": "국가 간 규제 공통화 추진, 농촌 원전 지원 1.75억 달러, 니제르 우라늄 금융 등 공급망 확보 가속", "article_ids": ["2026-09-19-06", "2026-09-19-09", "2026-09-19-12", "2026-09-19-13", "2026-09-19-17"] },
    { "country": "CN", "name_ko": "중국", "stance": "expanding", "signal": "창장 3호기 상업운전(가동 61기), 화룽원 2.0 실증로 착공 — 자국 노형 세대교체 진행", "article_ids": ["2026-09-19-03", "2026-09-19-08", "2026-09-19-15"] },
    { "country": "JP", "name_ko": "일본", "stance": "cautious", "signal": "주부전력 하마오카 데이터 조작 — 경영진 사퇴·재가동 신청 철회", "article_ids": ["2026-09-19-14"] },
    { "country": "NE", "name_ko": "니제르", "stance": "steady", "signal": "쿠데타 이후 멈췄던 서방 우라늄 투자 재개 신호(미 DFC 최대 4.14억 달러)", "article_ids": ["2026-09-19-09"] },
    { "country": "INT", "name_ko": "국제기구·다국가", "stance": "expanding", "signal": "산업협회 공동성명, NEA 비용 분석, IAEA 제70차 총회 — 확대 기조와 비용·금융 과제 동시 부각", "article_ids": ["2026-09-19-02", "2026-09-19-06", "2026-09-19-16"] }
  ],
  "articles": [
    {
      "id": "2026-09-19-01",
      "title": "Natural draft cooling tower is preferred JEK2 option",
      "title_ko": "슬로베니아 JEK2, 자연통풍 냉각탑을 우선 방안으로 선정",
      "language": "en",
      "source": "World Nuclear News",
      "url": "https://www.world-nuclear-news.org/articles/natural-draft-cooling-tower-is-preferred-jek2-option",
      "published": "2026-09-18",
      "category": "large",
      "countries": ["SI"],
      "importance": 3,
      "summary_ko": "크르슈코 부지에 추진 중인 JEK2 사업이 타당성 조사 결과 높이 193~198m의 자연통풍 냉각탑을 우선 방안으로 정했다. 적합 노형으로는 Westinghouse AP1000과 EDF EPR이 제시돼 있으며, FID는 2029년·상업운전은 2041년 목표다. 건설비는 1,000MWe급 98억 유로, 1,650MW급 154억 유로로 추산됐다.",
      "sales_note": "적합 노형이 AP1000·EPR 두 개로 좁혀져 있어 추가 진입 여지는 제한적이다. 대신 기자재·시공 협력 기회를 볼 만하다. 274km 도로 운송 경로와 112개 개조 지점 등 대형 기자재 물류 조건도 참고할 것.",
      "related": []
    },
    {
      "id": "2026-09-19-02",
      "title": "Industry groups call for governments commitment for nuclear growth",
      "title_ko": "9개 원자력 산업협회, 정부의 원전 확대 지원 공동 촉구",
      "language": "en",
      "source": "World Nuclear News",
      "url": "https://www.world-nuclear-news.org/articles/industry-groups-call-for-government-commitment-for-nuclear-growth",
      "published": "2026-09-18",
      "category": "policy",
      "countries": ["INT", "KR", "US", "JP", "FR", "GB", "CA"],
      "importance": 2,
      "summary_ko": "OECD NEA와 미국 DOE가 파리에서 공동 주최한 'Roadmaps to New Nuclear' 회의에서 한국원자력산업협회(KAIF), NEI, JAIF, 뉴클리어유럽 등 9개 협회가 공동성명을 냈다. 장기 정책, 계속운전, 공급망, 금융 접근성, 국제 규제 협력을 요구했다. 현재 15개국에서 약 80GW가 건설 중이고, 원자력 3배 확대를 지지하는 나라는 38개국이다.",
      "sales_note": "KAIF가 공동성명에 참여해 한국 업계가 서방 진영 공조 틀 안에 있음을 보여준다. '금융 접근성'과 '규제 협력'이 발주국 설득 포인트로 계속 쓰일 전망이다.",
      "related": ["https://www.nucnet.org/news/industry-associations-join-forces-to-call-for-government-action-on-nuclear-9-5-2026"]
    },
    {
      "id": "2026-09-19-03",
      "title": "China's Changjiang-3 Hualong One Reactor Begins Commercial Operation",
      "title_ko": "중국 창장 3호기(화룽원) 상업운전 개시",
      "language": "en",
      "source": "NucNet",
      "url": "https://www.nucnet.org/news/china-s-chiangjiang-3-hualong-one-reactor-begins-commercial-operation-9-5-2026",
      "published": "2026-09-18",
      "category": "large",
      "countries": ["CN"],
      "importance": 2,
      "summary_ko": "하이난성 창장 3호기(화룽원)가 7월 10일 첫 임계, 8월 1일 계통연결을 거쳐 9월 17일 상업운전에 들어갔다. 화넝그룹이 주도한 첫 대형 원전이다. 2단계(3·4호기) 투자액은 400억 위안, 연간 발전량은 180억 kWh 규모다. 이로써 중국의 상업운전 원전은 61기가 됐다.",
      "sales_note": "임계부터 상업운전까지 약 2개월 반이 걸렸다. 중국이 해외 입찰에서 공기 경쟁력의 근거로 내세울 실적이다.",
      "related": ["https://www.world-nuclear-news.org/articles/third-unit-at-changjiang-site-commissioned"]
    },
    {
      "id": "2026-09-19-04",
      "title": "UK regulators to begin Xe-100 design assessment",
      "title_ko": "영국 규제기관, X-energy Xe-100 일반설계평가(GDA) 착수",
      "language": "en",
      "source": "World Nuclear News",
      "url": "https://www.world-nuclear-news.org/articles/uk-regulators-to-begin-xe-100-design-assessment",
      "published": "2026-09-18",
      "category": "smr",
      "countries": ["GB", "US"],
      "importance": 3,
      "summary_ko": "영국 정부가 ONR·환경청·웨일스 자연자원청에 X-energy의 고온가스로 Xe-100에 대한 3단계 GDA 착수를 지시했다. 평가 기간은 약 3년으로 예상된다. 미국 NRC 심사 자료를 활용하는 방식이다. Centrica는 하틀풀 등에 최대 6GW 규모의 Xe-100 도입을 추진하고 있다.",
      "sales_note": "영국이 미국 NRC 심사 결과를 끌어다 쓰는 방식을 굳히고 있다. 미국 인허가를 선행한 SMR일수록 영국 진입이 쉬워지는 구조라 i-SMR 등 후발 노형의 인허가 전략에 참고해야 한다.",
      "related": ["https://www.ans.org/news/2026-09-17/article-8396/uk-regulators-plan-radical-reforms-begin-xe100-assessment/", "https://www.centrica.com/media-centre/news/2026/centrica-x-energy-advance-nuclear-plans-as-uk-regulators-to-begin-design-review-for-xe-100/"]
    },
    {
      "id": "2026-09-19-05",
      "title": "Google signs up for electricity from Finnish nuclear power plant",
      "title_ko": "구글, 핀란드 로비사 원전 전력 장기 구매 계약",
      "language": "en",
      "source": "World Nuclear News",
      "url": "https://world-nuclear-news.org/articles/google-signs-up-for-electricity-from-finnish-nuclear-power-plant",
      "published": "2026-09-14",
      "category": "large",
      "countries": ["FI", "US"],
      "importance": 3,
      "summary_ko": "구글이 포툼과 로비사 원전 출력의 최대 50%를 구매하는 약 22년짜리 PPA를 맺었다. 2028년에 일부 물량으로 시작해 2030~2049년에는 50%를 공급받는다. 계약은 출력증강과 2050년까지의 수명연장 투자(약 10억 유로)의 재원이 된다. 구글은 핀란드 데이터센터에 130억 유로를 투자할 계획이다.",
      "sales_note": "유럽 첫 빅테크–기존 원전 장기 PPA다. 계속운전·출력증강 사업에서 '수요처가 재원을 대는' 모델이 유럽으로 확산될 가능성이 있어, 계속운전 서비스 영업 기회로 볼 수 있다.",
      "related": ["https://www.bloomberg.com/news/articles/2026-09-09/google-gives-a-20-year-lifeline-to-nordic-nuclear-power-plant"]
    },
    {
      "id": "2026-09-19-06",
      "title": "Electricity Costs Could Fall Below $100/MWh For Large-Scale Reactors And SMRs If Fleets Evolve, Says NEA",
      "title_ko": "NEA \"함대(fleet) 건설 시 대형원전·SMR 발전단가 100달러/MWh 이하 가능\"",
      "language": "en",
      "source": "NucNet",
      "url": "https://www.nucnet.org/news/electricity-costs-could-fall-below-usd100-mwh-for-large-scale-reactors-and-smrs-if-fleets-evolve-says-nea-9-5-2026",
      "published": "2026-09-18",
      "category": "policy",
      "countries": ["INT"],
      "importance": 2,
      "summary_ko": "OECD NEA는 표준화된 설계를 여러 기 연속으로 건설하면 대형원전과 SMR 모두 전력 비용을 100달러/MWh 아래로 낮출 수 있다고 분석했다. 앞서 NEA는 신규 원전의 공기 지연과 예산 초과 악순환을 끊기 위한 행동을 촉구한 바 있다.",
      "sales_note": "'표준 설계 반복 건설' 실적은 한국형 원전(UAE 바라카 4기 연속 건설)의 핵심 강점과 맞닿아 있다. 제안서 논리로 인용할 만한 국제기구 근거다.",
      "related": []
    },
    {
      "id": "2026-09-19-07",
      "title": "First SMR funding agreed by European Investment Bank",
      "title_ko": "유럽투자은행(EIB), 첫 SMR 투자 — 핀란드 Steady Energy에 4천만 유로",
      "language": "en",
      "source": "World Nuclear News",
      "url": "https://www.world-nuclear-news.org/articles/first-smr-investment-by-european-investment-bank",
      "published": "2026-09-15",
      "category": "smr",
      "countries": ["FI", "EU"],
      "importance": 2,
      "summary_ko": "EIB가 지역난방용 SMR LDR-50을 개발하는 핀란드 Steady Energy에 전환사채 형태로 최대 4천만 유로를 투자하기로 했다. EIB의 첫 SMR 투자다. 자금은 2028년까지 연구개발·시험·인허가에 쓰이며, 첫 발전소 착공은 2029년이 목표다.",
      "sales_note": "EU 정책금융이 SMR로 문을 열었다. 유럽 SMR 사업 금융 구조에서 EIB 참여 가능성을 염두에 둘 것.",
      "related": []
    },
    {
      "id": "2026-09-19-08",
      "title": "Groundwork begins for demonstration Hualong One 2.0 units",
      "title_ko": "중국 진치먼 원전, 화룽원 2.0 실증로 2기 부지공사 착수",
      "language": "en",
      "source": "World Nuclear News",
      "url": "https://www.world-nuclear-news.org/articles/groundwork-begins-for-demonstration-hualong-one-20-units",
      "published": "2026-09-14",
      "category": "large",
      "countries": ["CN"],
      "importance": 2,
      "summary_ko": "저장성 진치먼 원전 2단계에서 화룽원 2.0 실증로 2기를 위한 굴착이 시작됐다. 6기가 모두 완공되면 설비용량은 약 7.2GWe, 연간 발전량은 55TWh 규모가 된다.",
      "sales_note": "중국이 화룽원 후속 노형 실증에 들어갔다. 향후 해외 수출 노형도 2.0으로 넘어갈 가능성이 있어 경쟁 노형 사양 변화를 추적해야 한다.",
      "related": []
    },
    {
      "id": "2026-09-19-09",
      "title": "US Approves Up To $414 Million For Global Atomic's Dasa Uranium Project In Niger",
      "title_ko": "미국 DFC, 니제르 다사 우라늄 광산에 최대 4.14억 달러 금융 승인",
      "language": "en",
      "source": "NucNet",
      "url": "https://www.nucnet.org/news/us-approves-up-to-usd414-million-for-global-atomic-s-dasa-uranium-project-in-niger-9-5-2026",
      "published": "2026-09-18",
      "category": "fuel",
      "countries": ["NE", "US"],
      "importance": 2,
      "summary_ko": "미국 개발금융공사(DFC)가 Global Atomic의 니제르 다사 우라늄 프로젝트에 최대 4억 1,400만 달러 금융을 승인했다. 2023년 군사 쿠데타 이후 수년간 불확실성이 이어진 끝에 나온 결정이다. 다사는 아프리카 최고 품위 우라늄 광상으로 평가된다.",
      "sales_note": "미국이 정책금융으로 비러시아 연료 공급망을 확보하고 있다. 발주국이 연료 공급 안정성을 따질 때 '서방 공급망' 논거가 강해진다.",